{
  "$schema": "https://json-schema.org/draft/2020-12/schema",
  "$id": "agent-alias-list-response.schema.json",
  "title": "AgentAliasListResponse",
  "type": "object",
  "additionalProperties": false,
  "required": ["version", "trace_id", "request_id", "count", "items"],
  "properties": {
    "version": { "type": "string", "minLength": 1 },
    "trace_id": { "type": "string", "minLength": 1 },
    "request_id": { "type": "string", "minLength": 1 },
    "count": { "type": "integer", "minimum": 0 },
    "items": {
      "type": "array",
      "items": { "$ref": "agent-alias.schema.json" }
    }
  }
}
