{
  "version": "v1",
  "trace_id": "trace_123",
  "request_id": "req_123",
  "count": 1,
  "items": [
    {
      "reindex_job_id": 7,
      "logical_name": "books_doc",
      "from_physical": "books_doc_v1_old",
      "to_physical": "books_doc_v1_new",
      "status": "BULK_LOAD",
      "params": {
        "index_prefix": "books_doc_v1_local"
      },
      "progress": {
        "total": 1000,
        "processed": 450,
        "failed": 2,
        "retries": 1,
        "cursor": { "last_material_id": 12345 }
      },
      "error": null,
      "started_at": "2026-01-29T08:00:00Z",
      "finished_at": null,
      "created_at": "2026-01-29T07:58:00Z",
      "updated_at": "2026-01-29T08:04:00Z",
      "paused_at": null
    }
  ]
}
